Tweet Link,Author Handle,Tweet Content,Views,Likes,Retweets,Replies,Tweet Creation Date,Scraped Date
https://x.com/JerryBr03050915/status/1901472541421527114,"JerryBr03050915","Trump is cutting off your money!  Chicago will be rough place once they start laying off police and illegal immigrants don’t get their rent, food and drugs paid for!

I think he is just using immigration as an excuse.  He wants to make reality show of surviving in Chicago without",16,0,0,1,2025-03-17T03:15:56+00:00,2025-11-13T17:49:19.530094+00:00
https://x.com/dario_dude/status/1900586226950041717,"dario_dude","I worked at Watertower Place during my undergrad at Columbia back in 05/06 and Michigan Ave relied heavily on tourism and that mall in particular.  Additionally, the rent is higher than giraffe puzzy in that building.",27,0,0,0,2025-03-14T16:34:02+00:00,2025-11-13T17:49:19.530094+00:00
https://x.com/IlliniDodgers/status/1887180787323208125,"IlliniDodgers","There was a chain in the 'burbs, ""Jakes"". Really good pizza and a full menu.  First place I ever had fries with the potato skin still on. 
I delivered for them at their Wheaton location as a side hustle and made enough to pay for our 2-week honeymoon in Jamaica!",108,2,0,0,2025-02-05T16:45:36+00:00,2025-11-13T17:48:48.746147+00:00
https://x.com/Lauren38886064/status/1956581384849342615,"Lauren38886064","Do you understand how things like medicaid and homeless services are paid?? BY BUSINESS AND JOBS!! COMMUNISTS WANT TO GIVE PPL FREE FREE FREE BUT CHASE AWAY ALL THE JOBS AND BUSINESSES AND THEN THE PLACE GOES TO SHIT!! LOOK AT CHICAGO, DC, LA, WAKE UP MY GOD!! do u work??",30,0,0,1,2025-08-16T04:58:48+00:00,2025-11-13T17:48:19.445397+00:00
https://x.com/neplvsvltra/status/1956538552000655716,"neplvsvltra","Always some of the prettiest women when I’m in the Chicago airport. But are there a plethora of jobs in this fantastical wonderland place?",105,0,0,0,2025-08-16T02:08:36+00:00,2025-11-13T17:48:19.445397+00:00
https://x.com/GeorgeJourneys/status/1955771264586449056,"GeorgeJourneys","These cuts make sense if U Chicago cannot credibly place new mint PhDs in TT jobs in these fields any more (and are anticipating reductions in these disciplines at other universities).  And if Chicago cannot do this the situation would be far worse at lower ranked universities.",196,2,0,0,2025-08-13T23:19:40+00:00,2025-11-13T17:48:19.445397+00:00
https://x.com/grant_gambling/status/1954995976265142496,"grant_gambling","for the midwest, stl, chicago, kc and denver are comparable cities. 

dc is bad like those place. the crime is real and it isn’t reported properly because it’s a lot of minors.

i don’t care that he’s mobilizing the military if only to shame the locals into doing their jobs.",55,0,0,0,2025-08-11T19:58:57+00:00,2025-11-13T17:48:19.445397+00:00
https://x.com/blankchecklazy4/status/1953550097410929003,"blankchecklazy4","The horrible thing is is that it became part of the culture to stay in a place where there are no jobs and depend on the government to feed you and house you. And anyway people don't need excuses to kill each other. Just look at Chicago. Top of the charts for decades!",16,0,0,0,2025-08-07T20:13:33+00:00,2025-11-13T17:48:19.445397+00:00
https://x.com/BargainBoom/status/1952337921802965370,"BargainBoom","Its Tier 2 only. Which should have never existed in the first place. Tier 2 firemen in Chicago dont even get EMT or Hazard pay for months/years after the academy... how would you like to work for free for jobs you have to do?",92,1,0,0,2025-08-04T11:56:47+00:00,2025-11-13T17:48:19.445397+00:00
https://x.com/Neil2History/status/1948762597626409054,"Neil2History","No one we know is shocked - except the lawyers advising (For payment) that you all Illegal Aliens ought not to worry. Go work your untaxed no benefits cash jobs enriching eg Pot Farm in California or a Chicago burrito place we know. Cartels won't get their $; They R Pissed",35,0,0,0,2025-07-25T15:09:44+00:00,2025-11-13T17:48:19.445397+00:00
https://x.com/mattconvente/status/1945151062266028466,"mattconvente","I wonder if a big reason why Chicago is skipped is because the people who are mobile enough to move to a city in the first place are going towards cities with more cachet and jobs.

To me, it's not ""why don't more people live in Chicago?,"" it's ""why don't they *move* to Chicago?""",91,0,0,0,2025-07-15T15:58:47+00:00,2025-11-13T17:48:19.445397+00:00
https://x.com/TeamWorkOnline/status/1944187825689440325,"TeamWorkOnline","Executive Sous Chef | Full-Time | McCormick Place Convention Center - Oak View Group (Chicago · IL)",2110,0,0,0,2025-07-13T00:11:13+00:00,2025-11-13T17:48:19.445397+00:00
https://x.com/Psihogios1/status/1944127319636865372,"Psihogios1","Just helped move my daughter out of Chicago. Such a gr8 fun city.  Rents have gone up a lot since Covid so it’s hard to get ahead but still a gr8 place to live after college & meet interesting people, enjoy the arts, work 2 jobs and party hard.

She never had any issues in 6 yrs",27,0,0,0,2025-07-12T20:10:47+00:00,2025-11-13T17:48:19.445397+00:00
https://x.com/bill_thanoukos/status/1944050590767562787,"bill_thanoukos","Great work from 
@GovPritzker
 and 
@IllinoisDCEO
!

Clean tech, good jobs, and future-facing industry - exactly the kind of business we need to attract. 

Let’s make Chicago a place where companies like Pure Lithium want to be, and where their employees want to stay and thrive.",83,0,0,0,2025-07-12T15:05:54+00:00,2025-11-13T17:48:19.445397+00:00
https://x.com/CHICrimeNow/status/1940612298164322650,"CHICrimeNow"," Car Crash 

 W Pershing Rd & S Kedzie Ave, Chicago, Illinois, 60632

 Alright, jobs still pending on the board. We have a music disturbance, 6510 South Marshfield, a disturbance, 7239 South Yale, a disturbance, 7056 South Parnell, some music, 17, 1474 West 72nd Place, a",67,0,0,0,2025-07-03T03:23:21+00:00,2025-11-13T17:48:19.445397+00:00
https://x.com/JohnLockar41340/status/1940111973850783906,"JohnLockar41340","She's not likely to see 1 in NY or Chicago the place these but jobs dwell.",3,0,0,0,2025-07-01T18:15:14+00:00,2025-11-13T17:48:19.445397+00:00
https://x.com/RealJohnFeeley/status/1936875446886707357,"RealJohnFeeley","Takes place in Chicago, story of men and their intense jobs, would have been a good fit. Also apparently Ron Howard is making another fireman movie.",21,0,0,0,2025-06-22T19:54:26+00:00,2025-11-13T17:48:19.445397+00:00
https://x.com/cainmarkj/status/1936235057754300746,"cainmarkj","Chicago's government is working...it's successful?

Threatening to (illegally) arrest ICE agents will make Chicago a better place to live and work?

Aiding and abetting Illegal aliens who are ""stealing"" jobs from blue collar US citizens will make Chicago a better place to live",92,2,3,0,2025-06-21T01:29:45+00:00,2025-11-13T17:48:19.445397+00:00
https://x.com/sw6blues11/status/1936180421462835220,"sw6blues11","Really ? 
I lived in a place with almost no new immigration.
There are many such places across the country.
Who do you think has those jobs, there ?
Get out of Chicago, once in a while, you champagne liberal.",24,0,0,1,2025-06-20T21:52:39+00:00,2025-11-13T17:48:19.445397+00:00
https://x.com/Dale94550/status/1935681305142079513,"Dale94550","Just outside Chicago, is a place called ILLINOIS. Remember this in the next election. You have been subsidizing Chicago with jobs to keep in power through Chcago machine politics. ILLINOIS WILL REMEMBER THIS.",10,0,0,0,2025-06-19T12:49:21+00:00,2025-11-13T17:48:19.445397+00:00
https://x.com/twilightgirl692/status/1934965487781257491,"twilightgirl692","No. All of my past jobs were in downtown Chicago. I  left on good terms and 2 were department stores in downtown Chicago. The first place filed for bankruptcy. The second place moved their corporate offices to Minneapolis MN. The last place was at a law firm until I retired.",10,0,0,0,2025-06-17T13:24:56+00:00,2025-11-13T17:48:19.445397+00:00
https://x.com/dannymsn77/status/1934572054566580705,"dannymsn77","From Sunday:

I am in the middle of tearing a roof top deck out to find a leak on the rubber underneath. I’m sweaty, bleeding in a couple of spots and I’m questioning if I should’ve charged a lot more, why do I agree to do jobs in the city of Chicago in the first place?? Why",1721,33,1,11,2025-06-16T11:21:35+00:00,2025-11-13T17:48:19.445397+00:00
https://x.com/ElenaPe71135734/status/1934422446947361233,"ElenaPe71135734","YES! TIED for 1st place most incompetent Mayor along with Chicago 's Mayor Brandon Johnson who don't do their jobs and blame President Trump for their years of failure when President Trump has only been in office for 4 months !!!",11,1,0,0,2025-06-16T01:27:05+00:00,2025-11-13T17:48:19.445397+00:00
https://x.com/ZANmadden/status/1933544817939681421,"ZANmadden","To think Chicago would be the least attractive job for (and the ""last place"" Ben would choose) after Poles about nabbed him in the 2024 offseason - but had a better QB in place, great draft capital, and plenty of cap space compared to the other jobs Ben interviewed for....and",3763,6,0,5,2025-06-13T15:19:42+00:00,2025-11-13T17:48:19.445397+00:00
https://x.com/KingOldin/status/1932432944418767308,"KingOldin","I’d say maybe the law enforcement should warn these wack jobs that shoot to kill orders will be in place if this doesn’t stop now. I believe dem mayor Daley gave such orders back in the 60’s in Chicago.",8,0,0,0,2025-06-10T13:41:31+00:00,2025-11-13T17:48:19.445397+00:00
https://x.com/sampson_iv/status/1931705332268499050,"sampson_iv","Why do you think a large number of Black people moved to Chicago in THE FIRST PLACE?! Or even the Midwest overall

Now we are seeing folks leave those areas for the south due to lack of jobs, crime and cost of living. People move based on opportunities, affordability/housing, etc",28,2,0,1,2025-06-08T13:30:15+00:00,2025-11-13T17:48:19.445397+00:00
https://x.com/AuthorJannyB/status/1927023603456831500,"AuthorJannyB","I grew up in the Chicago suburbs, then had to spend 11 years in northeast Indiana for jobs, etc. But I had to come back, because nowhere else feels like home. 
So please don't badmouth my town. Yes, it ain't perfect. But no place is!",7,0,0,0,2025-05-26T15:26:44+00:00,2025-11-13T17:48:19.445397+00:00
https://x.com/DavidPeabo41657/status/1926615610840035472,"DavidPeabo41657","You'll find that Chicago didn't stay this way. After prohibition was raised and the men came back from war cities like Chicago and Detroit became sprawling industrial powerhouses providing jobs for everyone. It returned to this place after ( for many reasons) factories moved out",13,0,0,0,2025-05-25T12:25:31+00:00,2025-11-13T17:48:19.445397+00:00
https://x.com/Beardsly47/status/1924136816413671536,"Beardsly47","Modern blue-collar jobs should be hovering around $50/hr with all the standard benefits and insurances. Thats not management, that's working on the line in some place like Detroit or Chicago. Manufacturing the Might that was American. Thats if NAFTA never existed, & we weren't",15,0,0,0,2025-05-18T16:15:40+00:00,2025-11-13T17:48:19.445397+00:00
https://x.com/monkmodewemby/status/1923017573320269941,"monkmodewemby","Ignoring that for many people (myself included) Chicago is a wildly more enjoyable place to live, jobs don’t pay the same everywhere. I work in finance and my job is in-office in downtown Chicago. I’d probably take a 20-30% pay cut to live in Elgin. Horrible idea financially.",155,3,0,0,2025-05-15T14:08:12+00:00,2025-11-13T17:48:19.445397+00:00
https://x.com/StopVirtuaStalk/status/1921944706172203484,"StopVirtuaStalk","Just like one cannot send a graphic images through a corporate LAN lines these basic protocols can easily be applied to mobile devices. Having these simple protocols in place save workers jobs, particularly women in fields normally dominated by men.",7,0,0,0,2025-05-12T15:05:00+00:00,2025-11-13T17:48:19.445397+00:00
https://x.com/WCTA_Chicago/status/1921048438914855423,"WCTA_Chicago","Shadow selfie that works on many levels. 
Feeling healthier and have been cleaning the house, Lol, it's what I do. I think of the place like a boat, I keep it clean and running so roommates with jobs can come home and chill.",190,13,1,0,2025-05-10T03:43:33+00:00,2025-11-13T17:48:19.445397+00:00
https://x.com/gambling_goat_/status/1920422780815966504,"gambling_goat_","Being born in Chicago and living there until 2021 after 46 years   Glad I left  great place to make your money and get out.  It use to be a beautiful clean downtown area and safe but since the BLM riots and far left whack jobs took over it’s a typical liberal shithole nowadays",23,4,0,0,2025-05-08T10:17:25+00:00,2025-11-13T17:48:19.445397+00:00
https://x.com/TradesDBr0/status/1920355027744604381,"TradesDBr0","Best place to look for jobs in Chicago? ",23,0,0,1,2025-05-08T05:48:11+00:00,2025-11-13T17:48:19.445397+00:00
https://x.com/mviski/status/1920278053756022843,"mviski","Grew up in the Cleveland area and have no plans to move back. The Midwest has very few jobs in my industry, and apart from Chicago, the urban fabric is severely decayed or was never built in the first place.",272,1,0,1,2025-05-08T00:42:19+00:00,2025-11-13T17:48:19.445397+00:00
https://x.com/LaziestofDans/status/1919123047120052445,"LaziestofDans","How does a partially government funded tax exempt organization have salaries over one MILLION dollars in the first place much less nut jobs.   
⁦
@USRoute41
⁩ 
⁦
@PekalaLaw
⁩",473,10,0,2,2025-05-04T20:12:44+00:00,2025-11-13T17:48:19.445397+00:00
https://x.com/MidWestMet/status/1918342314574987634,"MidWestMet","Plus demographics.  SF has a far smaller % of black residents than Chicago.  Enough black Chicagoans benefit through gov't/NGO jobs, programs to keep failed politicians like 
@ChicagosMayor
 in place.  That many black Chicagoans are harmed by their policy is less important.",50,3,0,1,2025-05-02T16:30:23+00:00,2025-11-13T17:48:19.445397+00:00
https://x.com/AlxandreLaGrand/status/1918073704321318927,"AlxandreLaGrand","Shame. I think Chicago is an amazing place, your post inspired me to look for some jobs there. More affordable than I originally thought.",139,6,0,1,2025-05-01T22:43:01+00:00,2025-11-13T17:48:19.445397+00:00
https://x.com/michael_degori/status/1918010835034657194,"michael_degori","A lot to unpack here. Chicago is ENORMOUS. Blanket “unsafe” statement is dumb. Walkability varies based on neighborhood as with every other place? It’s less expensive than the coastal big cities. “Very few jobs” for who? Again just a weird blanket statement.",6,0,0,0,2025-05-01T18:33:12+00:00,2025-11-13T17:48:19.445397+00:00
https://x.com/Libs_OfChicago/status/1915081236634051058,"Libs_OfChicago","More from the Soul of Chicago.

Perhaps a social program for these young men, they probably just need jobs or a place to play basketball.",1229,24,5,3,2025-04-23T16:32:01+00:00,2025-11-13T17:48:19.445397+00:00
https://x.com/K_ManAndy/status/1907921389581172756,"K_ManAndy","The ’90s and early 2000s were great—if you already had wealth to build on. But if your parents and grandparents were locked out of homeownership, good jobs, you weren’t starting from the same place. 

Just in Chicago, immigrants were given shelter n jobs over homeless veterans.",15,0,0,1,2025-04-03T22:21:21+00:00,2025-11-13T17:48:19.445397+00:00
https://x.com/CeceRey/status/1907194633026740500,"CeceRey","there’s a special place in hell for companies that post jobs that say they’re in chicago when really they’re in naperville and schaumburg. ——-",144,0,0,0,2025-04-01T22:13:29+00:00,2025-11-13T17:48:19.445397+00:00
https://x.com/WatsonLadd/status/1903315775273988181,"WatsonLadd","Chicago has a lot: cheaper housing, great cultural institutions+neighborhoods. Could easily attract high end jobs and advertise as place to own a home for cheap to 20 somethings",77,2,0,1,2025-03-22T05:20:17+00:00,2025-11-13T17:48:19.445397+00:00
https://x.com/CepelinaiToday/status/1902871548823769438,"CepelinaiToday","Reverend Brian Sauder had good news in January for 58 faith-based organizations across the Midwest. His Chicago environmental nonprofit, Faith in Place. would be giving each of them a grant to fund tree planting in low-income communities and create urban forestry jobs to maintain",12,0,0,0,2025-03-20T23:55:05+00:00,2025-11-13T17:48:19.445397+00:00
https://x.com/jkl620/status/1900278654074065198,"jkl620","We got off the highway and drove through the factory area of East Chicago. My wife asked what is this place? I said remember it when anyone says they want to bring back factory jobs. This is the life they want us to live.",25,2,0,0,2025-03-13T20:11:51+00:00,2025-11-13T17:48:19.445397+00:00
https://x.com/coleman_carmela/status/1899149296403935640,"coleman_carmela","Regardless place there or not. They’re not taking jobs from anyone. No one wants those jobs. You have to be a fool to work for Dollar Tree and Family Dollar especially in the 100’s. Plus that company ain’t shit.",27,1,0,2,2025-03-10T17:24:11+00:00,2025-11-13T17:48:19.445397+00:00
https://x.com/marketsday/status/1897991504041550253,"marketsday","#Fed Chair Jerome #Powell will address the economy, inflation risks, and the impact of Trump’s new tariffs at 12:30 PM EST—just hours after the February jobs report. Speech takes place at the University of Chicago’s Booth School of Business.",198,0,0,0,2025-03-07T12:43:32+00:00,2025-11-13T17:48:19.445397+00:00
https://x.com/transatlenjoyer/status/1897969793799471580,"transatlenjoyer","Not sure if I would live in the Midwest cause I like multiculturalism and also there’s no jobs for what I do there. But Chicago doesn’t seem like a bad place to end up in",15,2,0,0,2025-03-07T11:17:16+00:00,2025-11-13T17:48:19.445397+00:00
https://x.com/wallstengine/status/1897967815363055631,"wallstengine","Fed Chair Jerome Powell will address the economy, inflation risks, and the impact of Trump’s new tariffs at 12:30 PM EST—just hours after the February jobs report. Speech takes place at the University of Chicago’s Booth School of Business.",59597,153,35,15,2025-03-07T11:09:24+00:00,2025-11-13T17:48:19.445397+00:00
https://x.com/GouldKylene/status/1897417925457551733,"GouldKylene","Every nook &corner of Chicago needs to be investigated it's the most corrupt place on earth..the citizens aren't safe..voter fraud is rampant the citizens votes do not count..ghost payroll/no show jobs..it's insane..plus supporting terrorists &the hatred of jews/hate crimes..",244,10,0,0,2025-03-05T22:44:20+00:00,2025-11-13T17:48:19.445397+00:00
https://x.com/asteriskwitch/status/1896389067803357480,"asteriskwitch","hiii if anyone knows of jobs hiring preferably in Chicago idk I gotta find something and a place to stay in the short term I could use some help w any leads also it doesn’t have to be in Chicago bc I gotta find a new place too but I love chicago so I gotta say preferably chicago",1716,22,14,3,2025-03-03T02:36:01+00:00,2025-11-13T17:48:19.445397+00:00
https://x.com/UCCharterSchool/status/1895266966749007992,"UCCharterSchool","The Chicago Park District is hosting Teen Opportunity Fairs at 3 locations throughout the city. These FREE events will take place on March 1, 8, and 15, and offer info about summer opps like jobs & special programs for Chicago youth ages 13-19. Learn more. 
https://
chicagoparkdistrict.com/events/teen-op
portunity-fairs
…",76,0,0,0,2025-02-28T00:17:11+00:00,2025-11-13T17:48:19.445397+00:00
https://x.com/Chicago_School2/status/1894172717416362381,"Chicago_School2","E.M. *creates* jobs. He  *creates* goods and services that others buy freely in their own best interests. This is how the US became wealthy and successful in the first place - to the benefit of ALL those who live here.
Suggesting he destroy his capital - which he created - and",15,0,0,0,2025-02-24T23:49:02+00:00,2025-11-13T17:48:19.445397+00:00
https://x.com/ChickenJoeSTL/status/1894018036958437793,"ChickenJoeSTL","I'm not sure how the jobs are up there, and it's not super close to St Louis, Chicago, KC or any other major metro, but it's also not too far away from anything. But I'll always have a special place in my heart for Quincy. I've been in love with it since the first time I visited",224,2,0,1,2025-02-24T13:34:23+00:00,2025-11-13T17:48:19.445397+00:00
https://x.com/IsafordImm21632/status/1892418666932703304,"IsafordImm21632","Get Green Cards by applying for EB-3 fast food jobs with McDonald’s at Carol Stream, Illinois with #isafordimmigration. 
Just 30 mins from downtown Chicago, Carol Stream is a great and very safe place to raise a family with a crime rate 22% lower than the national average.",32,1,0,0,2025-02-20T03:39:04+00:00,2025-11-13T17:48:19.445397+00:00
https://x.com/kees2success/status/1891880354702667870,"kees2success","KEES Executive Search Client Partner, 
@ConcordiaPlace
, seeks a Vice President of Philanthropy and Marketing. Learn more about this opportunity: 
https://
bit.ly/VP-Philanthrop
y-Marketing-Concordia-Place
…
#Nonprofit #Jobs #Philanthropy #Marketing #Chicago #OpentoWork #Earlychildhood",36,0,0,0,2025-02-18T16:00:00+00:00,2025-11-13T17:48:19.445397+00:00
https://x.com/TraceyRyniec/status/1890209313828007999,"TraceyRyniec","Big country. Lots of places to move to if a place doesn't float your boat. I've lived on both coasts. No better city in America than Chicago for jobs, affordability, food and culture. But you might have to leave it to find that out for yourself.",102,2,0,1,2025-02-14T01:19:53+00:00,2025-11-13T17:48:19.445397+00:00
https://x.com/ChiNormies/status/1890063860553728104,"ChiNormies","Like does this dweeb think that us not fighting to keep United in Chicago and losing 5000 jobs to Texas would result in them using less jet fuel? I’d love to hear the theory of how that would make the world, and especially Chicago a better place.",219,23,0,0,2025-02-13T15:41:54+00:00,2025-11-13T17:48:19.445397+00:00
https://x.com/inboundike/status/1886796997748785183,"inboundike","This definitely describes Houston too. Lots of Chicago people I know have moved down there for jobs, and admit the city kind of sucks in certain ways, but it's also a comfortable place to raise a family.",173,5,0,1,2025-02-04T15:20:33+00:00,2025-11-13T17:48:19.445397+00:00
https://x.com/notujacks/status/1885948384738972128,"notujacks","Why the put up with it and allow it to continue is beyond me. There are so many that could protest and change things but instead they let the non existent country of Pakistan terrorists steal their food, housing, jobs, etc. Chicago used to be my fave place to visit for a weekend",58,0,0,0,2025-02-02T07:08:28+00:00,2025-11-13T17:48:19.445397+00:00
https://x.com/NFLObjectors/status/1884280941893636449,"NFLObjectors","More to open.  NY, Chicago, Boston, LA.  Any place 
@RealTomHoman
 is active.  You should get in touch the companies that hired illegals and start jobs fairs recruiting black people. 
@USDOL
 should start smoothing the transition.",17,1,0,0,2025-01-28T16:42:39+00:00,2025-11-13T17:48:19.445397+00:00
https://x.com/Really5dog/status/1882482304863576458,"Really5dog","A bunch of numbers came out about how bad Chicago was doing...maybe with jobs....I saw Rahm speak that night. It was like he was talking about a different place.",72,0,0,0,2025-01-23T17:35:30+00:00,2025-11-13T17:48:19.445397+00:00
https://x.com/FueledByMotown/status/1882026156976930895,"FueledByMotown","People can stop with the “Ben Johnson was locked in on Chicago all week” narrative, which was always a very disrespectful thing to say about a guy that turned down HC jobs and returned to this place to come win a ring

#OnePride",606,3,0,0,2025-01-22T11:22:56+00:00,2025-11-13T17:48:19.445397+00:00
https://x.com/bkporcaro/status/1881472566365503525,"bkporcaro","Just like Caleb Williams, Ben Johnson was the obvious pick. Let’s save our props for what Poles and Warren do from here. The Bears have MAJOR holes at key positions and what happened to getting Bears fans a better place to watch games than outdated Soldier Field??? Do your jobs!",266,0,0,1,2025-01-20T22:43:10+00:00,2025-11-13T17:48:19.445397+00:00
https://x.com/livenlikeaking/status/1881016364795846930,"livenlikeaking","Rockford could/should be a nice place to live as a satellite city to Chicago and nearby DeKalb/ NIU. But a steadily declining manufacturing base, culminating w/the 1.200 jobs lost when Chrysler shuttered its Belvidere plant.",52,0,0,0,2025-01-19T16:30:23+00:00,2025-11-13T17:48:19.445397+00:00
https://x.com/TravelingPhil/status/1880820515754905901,"TravelingPhil","Looking for the best place to work in 2025? BCD is on Built In’s 2025 Best Places to Work lists:

Best Remote Large Places to Work
Best Places to Work in Atlanta
Best Large Places to Work in Atlanta
Best Large Places to Work in Chicago

Apply now: 
https://
ow.ly/AHCO50UJ4Zc",9,0,0,0,2025-01-19T03:32:09+00:00,2025-11-13T17:48:19.445397+00:00
https://x.com/TravelingPhil/status/1880482162081730887,"TravelingPhil","Looking for the best place to work in 2025? BCD is on Built In’s 2025 Best Places to Work lists:

Best Remote Large Places to Work
Best Places to Work in Atlanta
Best Large Places to Work in Atlanta
Best Large Places to Work in Chicago

Apply now: 
https://
ow.ly/F3zO50UITRr",10,0,0,0,2025-01-18T05:07:39+00:00,2025-11-13T17:48:19.445397+00:00
https://x.com/emcwilly/status/1880360319870202307,"emcwilly","Also not what I said. He wasn’t promoted to OC until they had that alignment in place and has been vocal about wanting that now that he has his choice of jobs. Like it or not, Chicago has been a shit show in that regard. Caleb Williams won’t get him to overlook that.",35,0,0,0,2025-01-17T21:03:30+00:00,2025-11-13T17:48:19.445397+00:00
