Tweet Link,Author Handle,Tweet Content,Views,Likes,Retweets,Replies,Tweet Creation Date,Scraped Date
https://x.com/SachinSekhri/status/1880250025659228431,"SachinSekhri","Looking for the best place to work in 2025? BCD is on Built In’s 2025 Best Places to Work lists:

Best Remote Large Places to Work
Best Places to Work in Atlanta
Best Large Places to Work in Atlanta
Best Large Places to Work in Chicago

Apply now: 
https://
ow.ly/3g8l50UHzc0",6,0,0,0,2025-01-17T13:45:14+00:00,2025-11-13T17:48:19.445397+00:00
https://x.com/JFDEMOL/status/1879889282917101811,"JFDEMOL","Looking for the best place to work in 2025? BCD is on Built In’s 2025 Best Places to Work lists:

Best Remote Large Places to Work
Best Places to Work in Atlanta
Best Large Places to Work in Atlanta
Best Large Places to Work in Chicago

Apply now: 
https://
ow.ly/ynQR50UHBJu",8,1,0,0,2025-01-16T13:51:46+00:00,2025-11-13T17:48:19.445397+00:00
https://x.com/REALNigersaurus/status/1879718771025408029,"REALNigersaurus","I am already seeing j33ts working in Subway near my friend's place at downtown Chicago. At that point, there won't be any jobs for anybody.",7,0,0,0,2025-01-16T02:34:13+00:00,2025-11-13T17:48:19.445397+00:00
https://x.com/RMartinBCD/status/1879623361233338807,"RMartinBCD","Looking for the best place to work in 2025? BCD is on Built In’s 2025 Best Places to Work lists:

Best Remote Large Places to Work
Best Places to Work in Atlanta
Best Large Places to Work in Atlanta
Best Large Places to Work in Chicago

Apply now: 
https://
ow.ly/7xzh50UHbhX",16,1,0,0,2025-01-15T20:15:05+00:00,2025-11-13T17:48:19.445397+00:00
https://x.com/WorldWideBears/status/1879570517696684101,"WorldWideBears","Add to that the fact that he said he would only take interviews for jobs he intended to take and he already interviewed with Bears brass. If he wanted to ""avoid"" Campbell, he wouldn't have accepted the interview request in the first place imo",753,8,0,1,2025-01-15T16:45:06+00:00,2025-11-13T17:48:19.445397+00:00
https://x.com/the92analysis/status/1876750419193377008,"the92analysis","An impressive second place. During that campaign the goal scoring ratio was 28-5. After this impressive campaign, MLS side Chicago Fire would hire Wicky. This wasn’t the most impressive of jobs as they would narrowly miss the MLS playoffs with an average of 1 point per game [3/4]",229,1,0,1,2025-01-07T21:59:02+00:00,2025-11-13T17:48:19.445397+00:00
https://x.com/nick420_ward/status/1876116967536644431,"nick420_ward","An area of a city primarily known for being a place of business which results in significant amounts of people all going to this area for their jobs. Examples would include Downtown Houston, the Chicago Loop, Lower Manhattan, etc.",146,1,0,1,2025-01-06T04:01:56+00:00,2025-11-13T17:48:19.445397+00:00
https://x.com/SamThePol/status/1874884315592417736,"SamThePol","6. Activist Infiltration – Presidents have always had the power to appoint a large number of people to positions throughout the federal government, but not to place them in permanent civil service jobs. Obama, with lessons learned from Chicago machine politics, salted the earth",16,0,0,1,2025-01-02T18:23:49+00:00,2025-11-13T17:48:19.445397+00:00
https://x.com/Poloponies35/status/1977333832828571667,"Poloponies35","He wants ice agents to be safe while they do their jobs. He wants cities like Chicago to be a safe place to live and the residents are asking him to bring the national guard. It’s obvious democrats want a civil war and Democrat politicians are calling for violence.",27,0,0,0,2025-10-12T11:21:37+00:00,2025-11-13T17:47:48.941492+00:00
https://x.com/harri90294/status/1976321329608655035,"harri90294","Johnson and Pritzker created that mess in Chicago, and they own it. They should be arrested for not doing their jobs in the first place, and creating that war zone with paid mobs",6,0,0,0,2025-10-09T16:18:17+00:00,2025-11-13T17:47:48.941492+00:00
https://x.com/MrAntiHero1/status/1976289818654146940,"MrAntiHero1","Maybe the Chicago authorities should've done their jobs in the first place instead of giving the fed an excuse to deploy the NG. Ya know, enforcing the law like they were elected to do.",27,0,0,1,2025-10-09T14:13:05+00:00,2025-11-13T17:47:48.941492+00:00
https://x.com/txfearsomefrank/status/1975959623476584959,"txfearsomefrank","If you and your Commie buddies were doing your jobs like 
@GregAbbott_TX
 
@DallasMayor
 and 
@KenPaxtonTX
.  This wouldn't be an issue.  Instead, you have turned Chicago into a festering pool of murder and violent crime.  A place where being an illegal alien is the only currency that",15,0,0,0,2025-10-08T16:21:00+00:00,2025-11-13T17:47:48.941492+00:00
https://x.com/dutchesjim/status/1975918201608548808,"dutchesjim","Chicago’s Mayor can not legally restrict ICE in so called ICE free zones. ICE will legally disregard that and go where they must to do their jobs.   If necessary the President can and should put Marshal Law in place.",17,1,0,0,2025-10-08T13:36:24+00:00,2025-11-13T17:47:48.941492+00:00
https://x.com/Cmanfuture17/status/1975832723941151130,"Cmanfuture17","Yep now there paying for it by everything playing out as it is like u said they should’ve done there jobs properly and kept the people of Chicago safe now things are happening they way they are shouldn’t have had to get to that point in the first place",47,1,0,1,2025-10-08T07:56:45+00:00,2025-11-13T17:47:48.941492+00:00
https://x.com/reesetheone1/status/1975580750394081296,"reesetheone1","Folks, illegals in Chicago isn’t taking a single job from a black person. Black folks won’t do the jobs those illegals are doing in the first place.

A lot of them would rather fight and die over a block they don’t own.

That’s why murders are so high here.",272,3,0,1,2025-10-07T15:15:30+00:00,2025-11-13T17:47:48.941492+00:00
https://x.com/udreams30/status/1975349207117504682,"udreams30","ICE FREE ZONES  …. The only place that works is in your refrigerator. Chicago Mayor Brandon Johnson thinks he can keep IMMIGRATION ENFORCEMENT from entering parts of his city. He thinks he can stop them from doing their jobs. I don’t understand why Democrats are fighting so hard",13768,204,172,43,2025-10-06T23:55:25+00:00,2025-11-13T17:47:48.941492+00:00
https://x.com/westernbachelor/status/1975324639871332744,"westernbachelor","https://
cnn.com/2025/10/05/us/
national-guard-chicago-portland-restraining-order-hnk
…

Maybe don't stop ICE agents from doing their jobs that they were federally mandated to do. These people shouldn't be in the country in the first place. The president told you not to prevent ice from doing their jobs.",31,0,0,0,2025-10-06T22:17:48+00:00,2025-11-13T17:47:48.941492+00:00
https://x.com/fixitman17/status/1975304360902205733,"fixitman17","It’s nut jobs like this mayor in Chicago who are the core of the problem in this country you have to get rid of these mentally ill nut jobs. They have no place in our country and they are destroying it systematically.",16,1,0,0,2025-10-06T20:57:13+00:00,2025-11-13T17:47:48.941492+00:00
https://x.com/TigerWolven/status/1975255584023978166,"TigerWolven","Ya know Chicago isn't the only place in Illinois.....why can't new kids find jobs when they're American huh.......... ""Illinois and Chicago????"" This makes no sense it is a name of land. Those people need to leave 

Source: CNN",93,0,0,1,2025-10-06T17:43:24+00:00,2025-11-13T17:47:48.941492+00:00
https://x.com/dmarquarknox/status/1974940473333813595,"dmarquarknox","If chicago pd was decent at their jobs, this wouldn't be necessary in the first place.",12,3,0,0,2025-10-05T20:51:16+00:00,2025-11-13T17:47:48.941492+00:00
https://x.com/joycjoint/status/1974360177249001863,"joycjoint","Chicago Dems interfering with commerce and undoubtedly causing more than a few people to lose their jobs due to a loss in customers and income. They are literally doing their part to destroy the place they call home. That's Democrats for you.",75,0,0,0,2025-10-04T06:25:22+00:00,2025-11-13T17:47:48.941492+00:00
https://x.com/RemoteAround/status/1974190467479908840,"RemoteAround"," Ready to analyze, optimize & snack endlessly?  Smokeball ( Best Place to Work) is hiring a Business Analyst in Chicago! 

REMOTE ROLE BUSINESS ANALYST: 
https://
remotearround.com/job/business-a
nalyst-6/
…

REMOTE JOBS USA: 
https://
remotearround.com/jobs-list-v1/?
filter-title=REMOTE
…

#REMOTEarrounduSA #vacancies #BusinessAnalyst #Chica",71,0,0,0,2025-10-03T19:11:00+00:00,2025-11-13T17:47:48.941492+00:00
https://x.com/StopVirtuaStalk/status/1973402525760942188,"StopVirtuaStalk","These basic protocols can easily be applied to mobile devices. Having these simple protocols in place save workers jobs, particularly women in fields normally dominated by men.",9,0,0,0,2025-10-01T15:00:00+00:00,2025-11-13T17:47:48.941492+00:00
https://x.com/therealhamishb/status/1973033605795561609,"therealhamishb","This is exactly what Chicago needs in order to become a viable place of doing business.

Sadly you and that  brainstem of a mayor have refused to do your jobs,

GO  ICE.  GO NATIONAL GUARD.

Make Chicago decent again.",32,0,0,0,2025-09-30T14:34:03+00:00,2025-11-13T17:47:48.941492+00:00
https://x.com/NVHSR/status/1972536527428415689,"NVHSR","They're supplying security against ""protestors"" who're blocking ICE agents while they're doing their jobs, then they're not props. Someone who lets a nearly every weekend slaughter take place in Chicago & employs props of ""peacemakers"" to excuse his inaction, would call them that",71,2,0,0,2025-09-29T05:38:50+00:00,2025-11-13T17:47:48.941492+00:00
https://x.com/flockd16/status/1971013888650117420,"flockd16","Who works in Chicago?  Bunch of lazy youth and old people getting money to help buy groceries. Problem the left put us here sending your jobs elsewhere & bringing in others to work in your place. Idiots being replaced daily.",4,0,0,0,2025-09-25T00:48:25+00:00,2025-11-13T17:47:48.941492+00:00
https://x.com/KristyWavra1/status/1969399715126005966,"KristyWavra1","No-These cities do have his to protect their citizens! I live 80 miles from Chicago and ICE is all over the place- hauling people away at their jobs, swarming into “Culver’s”and causing an uproar! There are better ways of doing things! Think of Trump’s last term- it took years to",28,0,0,0,2025-09-20T13:54:16+00:00,2025-11-13T17:47:48.941492+00:00
https://x.com/Faded0276/status/1969250937630818378,"Faded0276","btw I'm don't really want to diss chicago but every car company gave the fuck up on that place like holy shit go the fuck back to chicago they still don't got fucking jobs.",7,0,0,0,2025-09-20T04:03:05+00:00,2025-11-13T17:47:48.941492+00:00
https://x.com/CHICrimeNow/status/1969238150313648540,"CHICrimeNow"," Woman Slumped Inside SUV at Jewel 

 3400 N Western Ave, Chicago, Illinois, 60618

 Alright, we got a couple of jobs pending. We have a suspicious person coming in, 525 West Arlington Place, no complainant. But they said that there is a male Black in the alley going back",49,0,0,0,2025-09-20T03:12:16+00:00,2025-11-13T17:47:48.941492+00:00
https://x.com/KathyZoll/status/1969164920617865478,"KathyZoll","SHE shouldn't have been there in the first place.  Chicago is a hell hole FULL of crime.  Let ICE do their jobs!!!!!!!!!!!!!!!!",21,0,0,0,2025-09-19T22:21:17+00:00,2025-11-13T17:47:48.941492+00:00
https://x.com/publicpolicyman/status/1968769635949465672,"publicpolicyman","ROOM PLACE CLOSING: On Elston, EMPTY CHICAGO STOREFRONT PROJECT: I am posting daily empty retail & restaurant space as businesses leave at a high rate. I blame massive property taxes, 10.50% sales tax, high state income tax, poor schools, high crime, retail theft, lack of jobs,",1056,26,3,3,2025-09-18T20:10:33+00:00,2025-11-13T17:47:48.941492+00:00
https://x.com/chikdarknes/status/1966571002759901560,"chikdarknes","'Summer in the City' by Kevin Phelps takes place in 1966. Corey lives in Chicago and has a very difficult life, working two jobs to support his alcoholic mother. Corey is a teenager; however, this novel is not suited for teenagers due to its content involving murder.",12,0,0,0,2025-09-12T18:33:58+00:00,2025-11-13T17:47:48.941492+00:00
https://x.com/kingofmphs/status/1965390179268719084,"kingofmphs","New Chicago is a disaster. It would’ve been a great place to put the jail and bring in jobs.",45,2,0,1,2025-09-09T12:21:48+00:00,2025-11-13T17:47:48.941492+00:00
https://x.com/EllaMoritis/status/1965197278102335650,"EllaMoritis","Chicago is between a rock and hard place. Their belief aligns with ICE but their jobs align with corrupt democrats",32,0,0,0,2025-09-08T23:35:17+00:00,2025-11-13T17:47:48.941492+00:00
https://x.com/ChicagoREDP/status/1963738360645603826,"ChicagoREDP","My Donnie is on the way and now everybody wants to get up and act like they’ve been working the whole time  How were *97* cars in the same place in the Chicago River if people have been doing their jobs?",843,33,6,1,2025-09-04T22:58:04+00:00,2025-11-13T17:47:48.941492+00:00
https://x.com/SteinbornMary/status/1962245218444443944,"SteinbornMary","Trump is not going to deploy National Guard to Chicago. The governor of Illinois would have to call them. And National Guard members are just people working ordinary jobs. 

But instead of being paranoid about Trump deploying the military all over the place, perhaps the governor",34,2,0,0,2025-08-31T20:04:51+00:00,2025-11-13T17:47:48.941492+00:00
https://x.com/Dancaa2006/status/1962185382159679539,"Dancaa2006","six killed two dozen shot. Have a good weekend in Chicago. Chicago people are posting all over the place of the crime. The man and the governor are sick people they need to lose their jobs.",8,0,1,0,2025-08-31T16:07:05+00:00,2025-11-13T17:47:48.941492+00:00
https://x.com/recallthisfall/status/1961189246225785261,"recallthisfall","Then please do your job. Help us clean up
Chicago Streets from armed thugs. Help us get a mayoral recall mechanism in place to remove our mentality unstable racist mayor. Help us get a municipal charter in place for Chicago. Help us attract jobs & businesses back to Chicago.",17,1,0,0,2025-08-28T22:08:48+00:00,2025-11-13T17:47:48.941492+00:00
https://x.com/RonBenDov211357/status/1960871789090971834,"RonBenDov211357","Chicago Teamsters, backed by mayor, want ICE blocked without warrants in strike fight 
https://
foxnews.com/politics/chica
go-teamsters-backed-mayor-want-ice-barred-without-warrants-strike-fight
… #FoxNews 
close the place down and let them go find jobs.",15,0,0,1,2025-08-28T01:07:20+00:00,2025-11-13T17:47:48.941492+00:00
https://x.com/CHICrimeNow/status/1960281277124255831,"CHICrimeNow"," Loud Music Coming From Residence 

 7921 South Hermitage Avenue, Chicago, Illinois, 60620

 I'm going to send you to the 10 sector to help us out with some of these jobs. Music disturbance, 7921 Hermitage. Another music, same place. In a Parker, 1050 West 79th.",37,0,0,0,2025-08-26T10:00:51+00:00,2025-11-13T17:47:48.941492+00:00
https://x.com/spiccolo216/status/1959393544986407193,"spiccolo216","The police cant do thier jobs because the mayor and pritzger took away thier ability.  We need Trump and the military to deport illegals.  Make arrests for crime. And arrest the mayor and gov for allowing us to be invaded in the first place!",69,3,1,0,2025-08-23T23:13:19+00:00,2025-11-13T17:47:48.941492+00:00
https://x.com/JustSoUKnow78/status/1958579999570571358,"JustSoUKnow78","Don't support or condone anything that happened from them leaving and going to Chicago Massachusetts and to the Caribbean to them coming back to them losing their seats and their jobs to being held captive and kidnapped at their place of employment and there was a mass shooting",11,0,0,1,2025-08-21T17:20:35+00:00,2025-11-13T17:47:48.941492+00:00
https://x.com/prof_chaos12/status/1957938319276302434,"prof_chaos12","Me and my husband moved out of Chicago because it was no place to raise a family. We both have good jobs and took our tax dollars to DuPage because of soft stances on crime. Ya’ll can have your Gen-Zers. They’ll wise up once they grow up!",20,0,0,0,2025-08-19T22:50:46+00:00,2025-11-13T17:47:48.941492+00:00
https://x.com/CHICrimeNow/status/1957864881715073268,"CHICrimeNow"," Car Crash 

 2622 West 15Th Place, Chicago, Illinois, 60608

 Alright, so PD jobs in 10 with the backlog. I have a Parker in the 10 sector, have an auto accident, PD only, 2622 West 15th Place. Another auto accident, they're calling back about the same one. A domestic",60,0,0,0,2025-08-19T17:58:57+00:00,2025-11-13T17:47:48.941492+00:00
https://x.com/druser/status/1957090463372001292,"druser","No lie: My stint selling Redwings was in a beloved country store a bit west of Chicago’s suburbs, that served as THE place folks from IL, WI, IA & MI serving in “real” jobs/industries would trek to for great work boots, workwear & top-notch, respectful & empathetic service to",23,1,0,1,2025-08-17T14:41:42+00:00,2025-11-13T17:47:48.941492+00:00
https://x.com/Jennyil/status/1956913820275769687,"Jennyil","My son went to the University of Iowa and when he graduated he looked at jobs in Iowa as well as other places. The place he looked at in Iowa were rural, no rental, he would have to buy a house with either a loan from his parents or the seller. He decided to live in Chicago",27,0,0,1,2025-08-17T02:59:47+00:00,2025-11-13T17:47:48.941492+00:00
https://x.com/BabyVaso/status/1988448070036844570,"BabyVaso","My father drew for local papers in Chicago Illinois in the 80s and It got me into animation quite early. I fell off in the early 2000s as CGI was taking place. From what I know (and this could be oudated) along with other prestigious jobs like CNA/Pharmacy which is what I went",106,1,0,0,2025-11-12T03:25:38+00:00,2025-11-13T16:52:48.186292+00:00
https://x.com/DonguskhanV/status/1984668795257114729,"DonguskhanV","No we have to same there here in south chicago even with jobs and industry. Its caused by иiggегs. They get great 30/hr government jobs and still ruin the place",69,5,0,1,2025-11-01T17:08:08+00:00,2025-11-13T16:52:48.186292+00:00
https://x.com/NewsCloset/status/1981543814444830857,"NewsCloset","At every place where these raids happen, employers increase wages so they can hire legal citizens. In Chicago, minorities were able to get hundreds of well-paying jobs that formerly went to illegals at a bread factory.",7,0,0,0,2025-10-24T02:10:35+00:00,2025-11-13T16:52:48.186292+00:00
https://x.com/westcoastrighty/status/1980504190628909326,"westcoastrighty","What are ""urban amenities""? Why would any of them take public transit? Have you seen the crime that takes place every day on public transit in LA? Where would they take transit to? LA has no central area where most of the good jobs are like Manhattan, Chicago, and San Fran",32,0,0,0,2025-10-21T05:19:29+00:00,2025-11-13T16:52:48.186292+00:00
https://x.com/SpaceWalk0/status/1979153097428496887,"SpaceWalk0","Gotta love Chicago. 24/7 ICE hysteria. Governor with highly suspicious gambling issue. Mayor who wants to tax jobs. Spend more on illegals healthcare than everything else combined. City and state are insolvent. Do people understand what a joke this place is???",478,5,0,1,2025-10-17T11:50:43+00:00,2025-11-13T16:52:48.186292+00:00
https://x.com/BrennanWoodruff/status/1978892863153807423,"BrennanWoodruff","1. None of those companies are investing in Chicago and Illinois because of ridiculously absurd regulation already in place
2. There are no ai jobs in Chicago as a result
3. So why would they invest in the people given they don’t have the skills they’d look to hire",258,10,0,0,2025-10-16T18:36:39+00:00,2025-11-13T16:52:48.186292+00:00
https://x.com/strappygal123/status/1978490230945554588,"strappygal123","ICE, go elsewhere this high school mentality. The city did not invite nor ask for help. Chicago does not want you there. I thought you were put in place to lower crime but ICE, you are provoking the masses to justify your jobs. Remember, you are human & smbdyz children, as well.",17,0,0,0,2025-10-15T15:56:44+00:00,2025-11-13T16:52:48.186292+00:00
https://x.com/joy_kornetta/status/1978328134526042623,"joy_kornetta","@GovPritzker
 
@ChicagosMayor
 what is YOUR PROBLEM? We, the ppl, in Chicago want 
@ICEgov
 
@DHSgov
 
@Sec_Noem
 HERE in this city since YOU can't & won't do your jobs! Why aren't you protecting them? You then take in the rapists, murderers etc! Big mansions, lots of room at YOUR place!",8,0,0,0,2025-10-15T05:12:37+00:00,2025-11-13T16:52:48.186292+00:00
https://x.com/Jameshenry1970/status/1977841129497526294,"Jameshenry1970","Agreed here in NY they are all over the place.. No matter what, Trade.. Especially on the Prevailing wage Jobs.. Washington state also all over.. Chicago saturated.. Mostly Mexican",24,1,0,0,2025-10-13T20:57:26+00:00,2025-11-13T16:52:48.186292+00:00
https://x.com/reading_while/status/1989010219301503434,"reading_while","What's better for US jobs than suddenly shutting down an entire growing industry?",12,0,0,0,2025-11-13T16:39:24+00:00,2025-11-13T16:49:18.237989+00:00
https://x.com/taco_twins/status/1989009457133551768,"taco_twins","Chicago STFU and let them do their jobs",2,0,0,0,2025-11-13T16:36:23+00:00,2025-11-13T16:49:18.237989+00:00
https://x.com/modmillenialMI/status/1989006435930276232,"modmillenialMI","Government/Taxpayer paid employees shouldn’t be allowed to be in a Union.
It’s corruption. 

Also can the teachers focus on teaching? Chicago has zero schools where the students are proficient in reading. The youths can’t get jobs if they can’t read. You’re failing them.",3,0,0,0,2025-11-13T16:24:22+00:00,2025-11-13T16:30:18.038696+00:00
https://x.com/surveyguy2/status/1989003790872162678,"surveyguy2","To misquote someone, is there an anti-trump way to fix pot holes? 

Seriously. Let's hope he focuses on getting the 3rd precinct open. And navigating the new 38th & Chicago in a way that is not a pedestrian plaza. stimulating business. Growing jobs. Working with the state/ county",8,0,0,1,2025-11-13T16:13:52+00:00,2025-11-13T16:30:18.038696+00:00
https://x.com/Earthworksjobs/status/1988991050090680619,"Earthworksjobs","Postdoctoral Researchers - climate engineering- Chicago, IL, USA - 
https://
earthworks-jobs.com/job?id=11220 #jobs #postdoc #ClimateEngineering",79,1,0,0,2025-11-13T15:23:14+00:00,2025-11-13T16:30:18.038696+00:00
https://x.com/Catsavia/status/1988983613896237407,"Catsavia","How many dems ditched their jobs in congress to go support illegals in Chicago? You may have forgot, we didn't",3,0,0,0,2025-11-13T14:53:41+00:00,2025-11-13T16:30:18.038696+00:00
https://x.com/ChiBizJournal/status/1988981470401077335,"ChiBizJournal","New grads are facing a tough market. Here are the top 'AI proof' entry-level jobs.",24,0,0,0,2025-11-13T14:45:10+00:00,2025-11-13T16:30:18.038696+00:00
https://x.com/_Midwest_Based/status/1988975541215719818,"_Midwest_Based","The ""free market"" allowed all of the jobs here to leave to Mexico/China and then allowed rich people from Chicago to scoop up affordable properties intended for local economy/ city/school sustaining families for cash, pricing us out of the market and turned them into Airbnbs.",14,1,0,1,2025-11-13T14:21:37+00:00,2025-11-13T16:30:18.038696+00:00
https://x.com/DisabledWriters/status/1988968526003233018,"DisabledWriters","@TheOnion
 is taking fellowship applications for its Spring 2026 writing fellowship, based in Chicago, IL. Deadline is December 4, 2025. 
https://
jobs.gusto.com/postings/the-o
nion-writing-fellowship-spring-2026-4f34351b-ba3f-452c-8a65-c70e046dbb49?utm_source=thewritersjob.beehiiv.com&utm_medium=newsletter&utm_campaign=twjn-pro-145-pitch-calls-writing-opportunities-media-jobs&_bhlid=c96ce33a3f79a08c834cfff4f816393dd7986193
…",22,0,0,0,2025-11-13T13:53:44+00:00,2025-11-13T16:30:18.038696+00:00
https://x.com/Wood_House76/status/1988962070302511612,"Wood_House76","Both threads as article 

Do not forget how Chicago officials’ used data distortion to shame “the unvaccinated,” coerce unnecessary shots, ban people from public places, and threaten city workers’ jobs.


https://
tinyurl.com/msvdnp6s",442,2,0,0,2025-11-13T13:28:05+00:00,2025-11-13T16:30:18.038696+00:00
https://x.com/MVTalent/status/1988961390581666214,"MVTalent","Hiring now in Chicago, IL – Buyer (FMCG Merchandise) for a global wine & spirits brand.
$70–80k + bonus + benefits.
Drive sourcing, supplier management & inventory control.
#BuyerJobs #Procurement #FMCG #SupplyChainCareers #PurchasingJobs 
https://
paiger.link/88059879",10,0,0,0,2025-11-13T13:25:23+00:00,2025-11-13T16:30:18.038696+00:00
https://x.com/JobsNowPR/status/1961531682860810596,"JobsNowPR","Fresh tax advisor role at EY Chicago
120k",6308,305,92,4,2025-08-29T20:49:31+00:00,2025-11-13T16:30:18.038696+00:00
https://x.com/JobsNowPR/status/1957631244713292022,"JobsNowPR","up to 189k for fully remote BI analyst at Caterpillar Chicago",26832,1908,325,20,2025-08-19T02:30:34+00:00,2025-11-13T16:30:18.038696+00:00
https://x.com/JobsNowPR/status/1957630877661638828,"JobsNowPR","Lots of jobs at Discover in Chicago today
up to 124k for this app engineer",10651,603,160,9,2025-08-19T02:29:06+00:00,2025-11-13T16:30:18.038696+00:00
https://x.com/JobsNowPR/status/1957630686199775309,"JobsNowPR","Now in chicago:
up to 415k for a sr product marketer at SAP",19169,1348,307,13,2025-08-19T02:28:21+00:00,2025-11-13T16:30:18.038696+00:00
https://x.com/JaymalGreen/status/1912553599147651365,"JaymalGreen","Chik-Fila, WELCOME TO THE SOUTHSIDE OF CHICAGO! I remember when I got the call after the meeting, I couldn’t believe it. They are starting with 100 jobs and 80% of the workers stay blocks away. This is what building community looks like, bigger announcements coming soon! ",11319,295,37,39,2025-04-16T17:08:06+00:00,2025-11-13T16:30:18.038696+00:00
